{
  "schema_version": 1,
  "generado_desde_datos": "2019-12-31T23:30",
  "clasificacion": "estimado_retrospectivo_no_operativo",
  "decision_operativa": "ninguna_localidad_habilitada",
  "metodo": {
    "unidad_evaluacion": "evento completo dentro de localidad y cuenca",
    "particion": "por evento y cuenca; nunca se dividen aleatoriamente lecturas de un mismo evento",
    "tipos_separados": [
      "fluvial",
      "pluvial_urbana",
      "costera_estuarina",
      "mixta_no_separada"
    ],
    "ventana_analisis_dias_antes_y_despues": 7,
    "criterio_hidrograma_completo": "al menos 24 h antes y después del pico, huecos <=12 h, ascenso y recesión >=0,20 m",
    "correccion_datum": false,
    "zona_horaria_series": "no publicada en los CSV; las horas se conservan sin zona y no se convierten",
    "limitaciones": [
      "La fecha CRI no delimita por sí sola el inicio y fin físico del evento.",
      "CRI no es un registro exhaustivo de eventos positivos ni negativos.",
      "Una coincidencia de umbral no valida datum ni causalidad hidráulica.",
      "Solo existen series públicas DINAGUA 2017-2019 para esta evaluación."
    ]
  },
  "fuentes_series": [
    {
      "anio": 2017,
      "url": "https://catalogodatos.gub.uy/dataset/03d936f2-5dc8-4e66-b936-5da8f2a7fdd1/resource/4a048882-ef6c-4fa7-b0ce-87207aa7741a/download/lecturas_anuales_nivel_2017.csv",
      "archivo": "lecturas_anuales_nivel_2017.csv",
      "bytes": 57109038,
      "sha256": "52f62a9b306220f194e5780fb8bb8bcf9b51236a1b0155893a8d2a80230bd47b",
      "licencia": "Licencia de Datos Abiertos de Uruguay (odc-uy)"
    },
    {
      "anio": 2018,
      "url": "https://catalogodatos.gub.uy/dataset/4ba2cad8-adc3-4e60-82d5-8183ce23717f/resource/155d7cf9-7744-4ecc-a097-7f5fb776d175/download/lecturas_anuales_nivel_2018.csv",
      "archivo": "lecturas_anuales_nivel_2018.csv",
      "bytes": 62536782,
      "sha256": "5286bac9ad6486444decd9e40583634c51bb577c8aedd163f7e2df51fd2f6da8",
      "licencia": "Licencia de Datos Abiertos de Uruguay (odc-uy)"
    },
    {
      "anio": 2019,
      "url": "https://catalogodatos.gub.uy/dataset/11b9f183-bbc4-4e5d-8047-b5647cf041cc/resource/3f035e36-da7e-4f3f-a707-d5c54a83e022/download/lecturas_anuales_nivel_2019.csv",
      "archivo": "lecturas_anuales_nivel_2019.csv",
      "bytes": 45278152,
      "sha256": "fe5db1dce2e3e4cda61c041005f67967ceee80d0a8d9ed3fa971a3d88a85ced8",
      "licencia": "Licencia de Datos Abiertos de Uruguay (odc-uy)"
    }
  ],
  "resumen": {
    "localidades_candidatas": 19,
    "localidades_con_estacion_superficial": 17,
    "localidades_con_curso_compatible": 14,
    "tipos_inundacion": {
      "costera_estuarina": 2,
      "fluvial": 15,
      "mixta_no_separada": 1,
      "pluvial_urbana": 1
    },
    "bloqueos_candidatos": {
      "curso_estacion_no_coincide": 3,
      "datum_vertical_no_validado": 19,
      "mecanismos_costero_y_pluvial_no_separados": 1,
      "relacion_hidraulica_no_validada_por_eventos_completos": 19,
      "requiere_modelo_pluvial_urbano": 1,
      "requiere_nivel_costero_y_forzantes_estuarinas": 2,
      "sin_estacion_superficial_compatible": 2,
      "umbrales_indistinguibles_dada_incertidumbre": 16
    },
    "eventos_registrados": 10,
    "eventos_con_cobertura": 5,
    "hidrogramas_completos": 5,
    "coincidencias_umbral": 4,
    "fallos_omision": 1,
    "localidades_habilitables": 0
  },
  "estaciones": {
    "Carmelo (Atracadero)": {
      "2017": {
        "observaciones_entrada": 13698,
        "observaciones_aceptadas": 13698,
        "inicio": "2017-01-01T00:00",
        "fin": "2017-12-29T03:30",
        "dias_con_datos": 289,
        "escalones_detectados": [],
        "segmentos_descartados": [],
        "limitacion": "el filtro detecta escalones persistentes; no detecta deriva lenta"
      },
      "2018": {
        "observaciones_entrada": 7096,
        "observaciones_aceptadas": 7096,
        "inicio": "2018-03-06T14:30",
        "fin": "2018-10-10T21:30",
        "dias_con_datos": 149,
        "escalones_detectados": [],
        "segmentos_descartados": [],
        "limitacion": "el filtro detecta escalones persistentes; no detecta deriva lenta"
      },
      "2019": {
        "observaciones_entrada": 11674,
        "observaciones_aceptadas": 11674,
        "inicio": "2019-04-29T12:10",
        "fin": "2019-12-31T23:30",
        "dias_con_datos": 246,
        "escalones_detectados": [],
        "segmentos_descartados": [],
        "limitacion": "el filtro detecta escalones persistentes; no detecta deriva lenta"
      }
    },
    "Constitución": {
      "2017": {
        "observaciones_entrada": 1043,
        "observaciones_aceptadas": 1043,
        "inicio": "2017-01-04T08:00",
        "fin": "2017-12-26T17:00",
        "dias_con_datos": 349,
        "escalones_detectados": [],
        "segmentos_descartados": [],
        "limitacion": "el filtro detecta escalones persistentes; no detecta deriva lenta"
      },
      "2018": {
        "observaciones_entrada": 749,
        "observaciones_aceptadas": 749,
        "inicio": "2018-01-05T08:00",
        "fin": "2018-12-31T17:00",
        "dias_con_datos": 253,
        "escalones_detectados": [],
        "segmentos_descartados": [],
        "limitacion": "el filtro detecta escalones persistentes; no detecta deriva lenta"
      },
      "2019": {
        "observaciones_entrada": 270,
        "observaciones_aceptadas": 270,
        "inicio": "2019-01-01T08:00",
        "fin": "2019-03-31T17:00",
        "dias_con_datos": 90,
        "escalones_detectados": [],
        "segmentos_descartados": [],
        "limitacion": "el filtro detecta escalones persistentes; no detecta deriva lenta"
      }
    },
    "Dolores": {
      "2017": {
        "observaciones_entrada": 1095,
        "observaciones_aceptadas": 1095,
        "inicio": "2017-01-01T07:00",
        "fin": "2017-12-31T18:00",
        "dias_con_datos": 365,
        "escalones_detectados": [],
        "segmentos_descartados": [],
        "limitacion": "el filtro detecta escalones persistentes; no detecta deriva lenta"
      },
      "2018": {
        "observaciones_entrada": 1095,
        "observaciones_aceptadas": 1095,
        "inicio": "2018-01-01T07:00",
        "fin": "2018-12-31T18:00",
        "dias_con_datos": 365,
        "escalones_detectados": [],
        "segmentos_descartados": [],
        "limitacion": "el filtro detecta escalones persistentes; no detecta deriva lenta"
      },
      "2019": {
        "observaciones_entrada": 279,
        "observaciones_aceptadas": 279,
        "inicio": "2019-01-01T07:00",
        "fin": "2019-05-31T18:00",
        "dias_con_datos": 93,
        "escalones_detectados": [],
        "segmentos_descartados": [],
        "limitacion": "el filtro detecta escalones persistentes; no detecta deriva lenta"
      }
    },
    "Dársena Higueritas": {
      "2017": {
        "observaciones_entrada": 1001,
        "observaciones_aceptadas": 1001,
        "inicio": "2017-01-01T08:00",
        "fin": "2017-11-30T18:00",
        "dias_con_datos": 334,
        "escalones_detectados": [],
        "segmentos_descartados": [],
        "limitacion": "el filtro detecta escalones persistentes; no detecta deriva lenta"
      },
      "2018": {
        "observaciones_entrada": 1095,
        "observaciones_aceptadas": 1095,
        "inicio": "2018-01-01T08:00",
        "fin": "2018-12-31T18:00",
        "dias_con_datos": 365,
        "escalones_detectados": [],
        "segmentos_descartados": [],
        "limitacion": "el filtro detecta escalones persistentes; no detecta deriva lenta"
      },
      "2019": {
        "observaciones_entrada": 300,
        "observaciones_aceptadas": 300,
        "inicio": "2019-01-01T08:00",
        "fin": "2019-06-30T18:00",
        "dias_con_datos": 100,
        "escalones_detectados": [],
        "segmentos_descartados": [],
        "limitacion": "el filtro detecta escalones persistentes; no detecta deriva lenta"
      }
    },
    "Florida (Puente Ruta 5)": {
      "2017": {
        "observaciones_entrada": 17515,
        "observaciones_aceptadas": 17515,
        "inicio": "2017-01-01T00:00",
        "fin": "2017-12-31T23:30",
        "dias_con_datos": 365,
        "escalones_detectados": [],
        "segmentos_descartados": [],
        "limitacion": "el filtro detecta escalones persistentes; no detecta deriva lenta"
      },
      "2018": {
        "observaciones_entrada": 17516,
        "observaciones_aceptadas": 17516,
        "inicio": "2018-01-01T00:00",
        "fin": "2018-12-31T23:30",
        "dias_con_datos": 365,
        "escalones_detectados": [],
        "segmentos_descartados": [],
        "limitacion": "el filtro detecta escalones persistentes; no detecta deriva lenta"
      },
      "2019": {
        "observaciones_entrada": 17492,
        "observaciones_aceptadas": 17492,
        "inicio": "2019-01-01T00:00",
        "fin": "2019-12-31T23:30",
        "dias_con_datos": 365,
        "escalones_detectados": [],
        "segmentos_descartados": [],
        "limitacion": "el filtro detecta escalones persistentes; no detecta deriva lenta"
      }
    },
    "La Charqueada": {
      "2017": {
        "observaciones_entrada": 28831,
        "observaciones_aceptadas": 28831,
        "inicio": "2017-01-01T00:00",
        "fin": "2017-12-31T23:30",
        "dias_con_datos": 349,
        "escalones_detectados": [],
        "segmentos_descartados": [],
        "limitacion": "el filtro detecta escalones persistentes; no detecta deriva lenta"
      },
      "2018": {
        "observaciones_entrada": 16249,
        "observaciones_aceptadas": 16249,
        "inicio": "2018-01-01T00:00",
        "fin": "2018-12-05T12:00",
        "dias_con_datos": 339,
        "escalones_detectados": [],
        "segmentos_descartados": [],
        "limitacion": "el filtro detecta escalones persistentes; no detecta deriva lenta"
      },
      "2019": {
        "observaciones_entrada": 14904,